"653JLCLP","conferencePaper","2018","Cobos, R.; Olmos, L.","A Learning Analytics Tool for Predictive Modeling of Dropout and Certificate Acquisition on MOOCs for Professional Learning","","","","10.1109/IEEM.2018.8607541","https://www.scopus.com/inward/record.uri?eid=2-s2.0-85061832448&doi=10.1109%2FIEEM.2018.8607541&partnerID=40&md5=1bda9a76797eb96afed36dc1321e5d80","","2018","2026-02-19 09:40:01","2026-02-19 09:40:01","","1533-1537","","","2019-December","","","","","","","","","","","","","Scopus","","","","","","","","","","","","","","","","","","","","","","","","","","","","","","","","","","","","","","","","IEEE International Conference on Industrial Engineering and Engineering Management","","","","","","","","","","","","","","",""
"BVRTLXDG","journalArticle","2018","Howard, E.; Meehan, M.; Parnell, A.","Contrasting prediction methods for early warning systems at undergraduate level","Internet and Higher Education","","","10.1016/j.iheduc.2018.02.001","https://www.scopus.com/inward/record.uri?eid=2-s2.0-85042237339&doi=10.1016%2Fj.iheduc.2018.02.001&partnerID=40&md5=08bd840611c4a2a82006b1919796e47d","","2018","2026-02-19 09:40:01","2026-02-19 09:40:01","","66-75","","","37","","","","","","","","","","","","","Scopus","","","","","","","","","","","","","","","","","","","","","","","","","","","","","","","","","","","","","","","","","","","","","","","","","","","","","","",""
"ARBSPZRM","conferencePaper","2018","Esswein, M.; Chamoni, P.","Business analytics in the Finance Department - A literature review","","","","","https://www.scopus.com/inward/record.uri?eid=2-s2.0-85048569409&partnerID=40&md5=36a6de0e37993ac1288d7f06c71e9758","","2018","2026-02-19 09:40:01","2026-02-19 09:40:01","","35-46","","","2018-March","","","","","","","","","","","","","Scopus","","","","","","","","","","","","","","","","","","","","","","","","","","","","","","","","","","","","","","","","MKWI 2018 - Multikonferenz Wirtschaftsinformatik","","","","","","","","","","","","","","",""
"NE5BZCBN","conferencePaper","2015","Klüsener, M.; Fortenbacher, A.","Predicting students' success based on forum activities in MOOCs","","","","10.1109/IDAACS.2015.7341439","https://www.scopus.com/inward/record.uri?eid=2-s2.0-84957575378&doi=10.1109%2FIDAACS.2015.7341439&partnerID=40&md5=31f2724d61229865685ed0a168af5edc","","2015","2026-02-19 09:40:01","2026-02-19 09:40:01","","925-928","","","2","","","","","","","","","","","","","Scopus","","","","","","","","","","","","","","","","","","","","","","","","","","","","","","","","","","","","","","","","Proceedings of the 2015 IEEE 8th International Conference on Intelligent Data Acquisition and Advanced Computing Systems: Technology and Applications, IDAACS 2015","","","","","","","","","","","","","","",""
"VM5GR7WH","conferencePaper","2015","Gulati, H.","Predictive analytics using data mining technique","","","","","https://www.scopus.com/inward/record.uri?eid=2-s2.0-84960926496&partnerID=40&md5=2741be8064c201ecd82e59ef6b4bf482","","2015","2026-02-19 09:40:01","2026-02-19 09:40:01","","713-716","","","","","","","","","","","","","","","","Scopus","","","","","","","","","","","","","","","","","","","","","","","","","","","","","","","","","","","","","","","","2015 International Conference on Computing for Sustainable Global Development, INDIACom 2015","","","","","","","","","","","","","","",""
"6WICPYJS","journalArticle","2014","Clifton, L.; Clifton, D.A.; Pimentel, M.A.F.; Watkinson, P.J.; Tarassenko, L.","Predictive monitoring of mobile patients by combining clinical observations with data from wearable sensors","IEEE Journal of Biomedical and Health Informatics","","","10.1109/JBHI.2013.2293059","https://www.scopus.com/inward/record.uri?eid=2-s2.0-84900823945&doi=10.1109%2FJBHI.2013.2293059&partnerID=40&md5=2c411f479244ac5fe7eaeee0c4e85a37","","2014","2026-02-19 09:40:01","2026-02-19 09:40:01","","722-730","","3","18","","","","","","","","","","","","","Scopus","","","","","","","","","","","","","","","","","","","","","","","","","","","","","","","","","","","","","","","","","","","","","","","","","","","","","","",""
"EK2VINNR","journalArticle","2014","Hu, Y.-H.; Lo, C.-L.; Shih, S.-P.","Developing early warning systems to predict students' online learning performance","Computers in Human Behavior","","","10.1016/j.chb.2014.04.002","https://www.scopus.com/inward/record.uri?eid=2-s2.0-84899842763&doi=10.1016%2Fj.chb.2014.04.002&partnerID=40&md5=bc81a87c464c8e38632e497e2bc94578","","2014","2026-02-19 09:40:01","2026-02-19 09:40:01","","469-478","","","36","","","","","","","","","","","","","Scopus","","","","","","","","","","","","","","","","","","","","","","","","","","","","","","","","","","","","","","","","","","","","","","","","","","","","","","",""
"EPEMXTPJ","journalArticle","2014","Ng, K.; Ghoting, A.; Steinhubl, S.R.; Stewart, W.F.; Malin, B.; Sun, J.","PARAMO: A PARAllel predictive MOdeling platform for healthcare analytic research using electronic health records","Journal of Biomedical Informatics","","","10.1016/j.jbi.2013.12.012","https://www.scopus.com/inward/record.uri?eid=2-s2.0-84899483965&doi=10.1016%2Fj.jbi.2013.12.012&partnerID=40&md5=7521e5afc0b5d0e5ec47aea362dc2be6","","2014","2026-02-19 09:40:01","2026-02-19 09:40:01","","160-170","","","48","","","","","","","","","","","","","Scopus","","","","","","","","","","","","","","","","","","","","","","","","","","","","","","","","","","","","","","","","","","","","","","","","","","","","","","",""